{
  "schemaVersion": "1.0.0",
  "id": "AS-20260927T205906-001",
  "generated_at": "2026-09-27T16:59:06-04:00",
  "scorecard_id": "SC-20260927T205906-001",
  "previous_assessment_id": null,
  "narrative": "Overall: RED. 31/45 cells passing. 3 cell(s) failing. 5 cell(s) in review. 3 cell(s) unknown (sensor coverage gap). Per-cell signals:\n  - F3×T1 FAIL: e2e_test → No test files found, exiting with code 1\n\nfilter: tests/e2e\ninclude: packages/*/tests/**/*.test.ts, packages/*/tests/**/*.spec.ts, tests/contract/**/*.test.ts,…\n  - F3×T2 REVIEW: TEST_COVERAGE_REPORT_MISSING\n  - F4×T4 UNKNOWN (SR exists but classifier returned UNKNOWN; check rule for kind=inventory_adherence)\n  - F4×T7 REVIEW: INVENTORY_PERFORMANCE_NO_READINGS\n  - F4×T9 REVIEW: INVENTORY_REGENERATION_NO_KINDS_TOUCHED\n  - F5×T4 REVIEW: HARNESS_INVARIANT_ALIGNMENT_UNMEASURED_IN_CI\n  - F5×T7 FAIL: harness_performance → HARNESS_PERFORMANCE_TOO_SLOW: median 503s, p95 3925s — above review thresholds.\n  - F5×T8 REVIEW: HARNESS_ROBUSTNESS_FLAKY\n  - F5×T9 FAIL: harness_green_main → HARNESS_GREEN_MAIN_BELOW_THRESHOLD: Main branch success rate 40.0% (over last 50 runs) is below review threshold 80%.",
  "deltas": [],
  "backlog_actions": {
    "additions": [],
    "completions": [],
    "deprioritizations": []
  },
  "recommended_priorities": []
}
